IMDB_rating,IMDB_title,IMDB_titleID,IMDB_title_name
5.2 based on 19 user ratings,Jandino: Whatever it Takes,/title/tt6999080/, Jandino: Whatever it Takes (2016) (TV Special) 
"7.2 based on 1,623 user ratings",Marc Maron: Too Real,/title/tt7335938/, Marc Maron: Too Real (2017) (TV Special) 
6.3 based on 310 user ratings,Mo Gilligan: Momentum,/title/tt10847330/, Mo Gilligan: Momentum (2019) (TV Special) 
6.6 based on 904 user ratings,Def Comedy Jam 25,/title/tt7427130/, Def Comedy Jam 25 (2017) (TV Special) 
6.8 based on 835 user ratings,Jeff Dunham: Beside Himself,/title/tt10847194/, Jeff Dunham: Beside Himself (2019) (TV Special) 
"6.6 based on 2,451 user ratings",Iliza Shlesinger: Confirmed Kills,/title/tt6081882/, Iliza Shlesinger: Confirmed Kills (2016) (TV Special) 
"7.0 based on 5,107 user ratings",Jerry Before Seinfeld,/title/tt7310906/, Jerry Before Seinfeld (2017) (TV Special) 
8.1 based on 920 user ratings,Sebastian Maniscalco: What's Wrong with People?,/title/tt2215489/, Sebastian Maniscalco: What's Wrong with People? (2012) (TV Special) 
5.9 based on 632 user ratings,Cedric the Entertainer: Live from the Ville,/title/tt5753806/, Cedric the Entertainer: Live from the Ville (2016) (TV Special) 
"8.7 based on 2,820 user ratings",Norm Macdonald Has a Show,/title/tt8139862/, Norm Macdonald Has a Show (2018) (TV Series) 
"6.4 based on 1,098 user ratings",Jeff Dunham: Relative Disaster,/title/tt7364706/, Jeff Dunham: Relative Disaster (2017) (TV Special) 
"8.6 based on 2,227 user ratings",Daniel Sloss: Live Shows,/title/tt8858472/, Daniel Sloss: Live Shows (2018) (TV Mini-Series) 
"8.2 based on 8,200 user ratings",Bill Burr: Paper Tiger,/title/tt10847306/, Bill Burr: Paper Tiger (2019) (TV Special) 
"6.7 based on 1,794 user ratings",Iliza Shlesinger: War Paint,/title/tt2836376/, Iliza Shlesinger: War Paint (2013) (TV Special) 
7.3 based on 525 user ratings,Mo Amer: The Vagabond,/title/tt9060526/, Mo Amer: The Vagabond (2018) (TV Special) 
6.9 based on 628 user ratings,Deon Cole: Cole Hearted,/title/tt10977680/, Deon Cole: Cole Hearted (2019) (TV Special) 
"6.6 based on 1,647 user ratings",Russell Peters: Almost Famous,/title/tt5946232/, Russell Peters: Almost Famous (2016) (TV Special) 
"7.8 based on 1,192 user ratings",Judah Friedlander: America Is the Greatest Country in the United States,/title/tt7582890/, Judah Friedlander: America is the Greatest Country in the United States (2017) (TV Special) 
4.3 based on 137 user ratings,Rodney Carrington: Here Comes the Truth,/title/tt7582798/, Rodney Carrington: Here Comes the Truth (2017) (TV Special) 
6.0 based on 367 user ratings,Arsenio Hall: Smart & Classy,/title/tt10150694/, Arsenio Hall: Smart and Classy (2019) (TV Special) 
"7.5 based on 1,718 user ratings",Beyond Stranger Things,/title/tt7570990/, Beyond Stranger Things (2017) (TV Series) 
"6.9 based on 1,705 user ratings",Jack Whitehall: At Large,/title/tt7539884/, Jack Whitehall: At Large (2017) (TV Special) 
"7.6 based on 4,489 user ratings",ADAM SANDLER 100% FRESH,/title/tt9036126/, Adam Sandler: 100% Fresh (2018) (TV Special) 
"5.8 based on 1,061 user ratings",Jenny Slate: Stage Fright,/title/tt10971520/, Jenny Slate: Stage Fright (2019) (TV Special) 
"7.5 based on 3,858 user ratings",Joe Rogan: Triggered,/title/tt6023444/, Joe Rogan: Triggered (2016) (TV Special) 
6.3 based on 201 user ratings,Wyatt Cenac: Brooklyn,/title/tt4286560/, Wyatt Cenac: Brooklyn (2014) (TV Special) 
5.8 based on 595 user ratings,Anjelah Johnson: Not Fancy,/title/tt4199110/, Anjelah Johnson: Not Fancy (2015) (TV Special) 
"7.2 based on 2,101 user ratings",Patton Oswalt: Annihilation,/title/tt7026230/, Patton Oswalt: Annihilation (2017) (TV Special) 
6.5 based on 695 user ratings,"Ron White: If You Quit Listening, I'll Shut Up",/title/tt9060534/," Ron White: If You Quit Listening, I'll Shut Up (2018) (TV Special) "
"7.8 based on 4,287 user ratings",Anthony Jeselnik: Thoughts and Prayers,/title/tt5087554/, Anthony Jeselnik: Thoughts and Prayers (2015) (Video) 
6.5 based on 71 user ratings,"Martin Matte: La vie, la mort...eh la la..!",/title/tt10965252/," Martin Matte: La vie, la mort... eh la la..! (2019) (TV Special) "
5.6 based on 194 user ratings,Russell Peters vs. the World,/title/tt3182064/," Russell Peters Versus the World (2013) (TV Series) aka ""Russell Peters vs. the World"" "
"7.1 based on 1,503 user ratings",Russell Peters: Notorious,/title/tt3295244/, Russell Peters: Notorious (2013) (TV Special) 
6.3 based on 803 user ratings,Christina P: Mother Inferior,/title/tt7057376/, Christina P: Mother Inferior (2017) (TV Special) 
"5.8 based on 1,077 user ratings",Chelsea Handler: Uganda Be Kidding Me Live,/title/tt4079776/," Uganda Be Kidding Me Live (2014) (TV Movie) aka ""Chelsea Handler: Uganda Be Kidding Me Live"" "
"5.9 based on 1,187 user ratings",Nikki Glaser: Bangin’,/title/tt10952752/, Nikki Glaser: Bangin' (2019) (TV Special) 
"7.4 based on 5,632 user ratings",Kevin Hart: Laugh at My Pain,/title/tt1999192/, Kevin Hart: Laugh at My Pain (2011) 
"7.6 based on 5,018 user ratings",Kevin Hart: Seriously Funny,/title/tt1714196/, Kevin Hart: Seriously Funny (2010) (TV Special) 
"7.5 based on 1,929 user ratings",Seth Meyers: Lobby Baby,/title/tt11168100/, Seth Meyers: Lobby Baby (2019) (TV Special) 
7.5 based on 444 user ratings,John Leguizamo's Latin History for Morons,/title/tt9777830/, John Leguizamo's Latin History for Morons (2018) 
"6.4 based on 1,339 user ratings","Dana Carvey: Straight White Male, 60",/title/tt6217368/," Dana Carvey: Straight White Male, 60 (2016) (TV Special) "
7.7 based on 992 user ratings,Bumping Mics with Jeff Ross & Dave Attell,/title/tt9203078/, Bumping Mics with Jeff Ross & Dave Attell (2018) (TV Series) 
"7.7 based on 1,340 user ratings",Mike Birbiglia: The New One,/title/tt11163014/, Mike Birbiglia: The New One (2019) (TV Special) 
"7.1 based on 2,052 user ratings",Michael Che Matters,/title/tt6209400/, Michael Che Matters (2016) (TV Special) 
"7.7 based on 1,603 user ratings",Mike Birbiglia: What I Should Have Said Was Nothing: Tales from My Secret Public Journal,/title/tt1188112/, Mike Birbiglia: What I Should Have Said Was Nothing (2008) (TV Special) 
6.2 based on 538 user ratings,Brian Regan: Nunchucks and Flamethrowers,/title/tt7679532/, Brian Regan: Nunchucks and Flamethrowers (2017) (TV Special) 
"7.3 based on 3,223 user ratings",Trevor Noah: Son of Patricia,/title/tt9170648/, Trevor Noah: Son of Patricia (2018) (TV Special) 
"6.5 based on 1,219 user ratings",Iliza Shlesinger: Unveiled,/title/tt11163008/, Iliza Shlesinger: Unveiled (2019) (TV Special) 
"7.5 based on 2,819 user ratings",Donald Glover: Weirdo,/title/tt2345525/, Donald Glover: Weirdo (2012) (TV Special) 
6.8 based on 895 user ratings,Colin Quinn: The New York Story,/title/tt6257714/, Colin Quinn: The New York Story (2016) (TV Special) 
7.1 based on 769 user ratings,Jeff Dunham: All Over the Map,/title/tt4209802/, Jeff Dunham: All Over the Map (2014) (TV Special) 
6.1 based on 381 user ratings,DeRay Davis: How to Act Black,/title/tt7288084/, DeRay Davis: How to Act Black (2017) (TV Special) 
"7.0 based on 2,127 user ratings",Chelsea Peretti: One of the Greats,/title/tt3804556/, Chelsea Peretti: One of the Greats (2014) (TV Special) 
"8.0 based on 6,642 user ratings",John Mulaney: The Comeback Kid,/title/tt5069564/, John Mulaney: The Comeback Kid (2015) (TV Special) 
5.9 based on 342 user ratings,Jeff Garlin: Our Man In Chicago,/title/tt11108064/, Jeff Garlin: Our Man in Chicago (2019) (TV Special) 
"8.4 based on 4,746 user ratings",Bill Burr: Let It Go,/title/tt1717578/, Bill Burr: Let It Go (2010) (TV Special) 
5.6 based on 73 user ratings,Natalia Valdebenito: Gritona,/title/tt7160286/, Natalia Valdebenito: Gritona (2017) (TV Special) 
6.9 based on 451 user ratings,Kathleen Madigan: Bothering Jesus,/title/tt6264486/, Kathleen Madigan: Bothering Jesus (2016) (Video) 
"7.7 based on 1,581 user ratings",Katt Williams: The Pimp Chronicles: Pt. 1,/title/tt0865482/, Katt Williams: The Pimp Chronicles Pt. 1 (2006) (TV Special) 
"7.4 based on 1,689 user ratings",Marc Maron: Thinky Pain,/title/tt3004634/, Marc Maron: Thinky Pain (2013) (TV Special) 
6.8 based on 55 user ratings,Sommore: The Reign Continues,/title/tt4172758/, Sommore: The Reign Continues (2015) (TV Special) 
4.1 based on 321 user ratings,A Russell Peters Christmas,/title/tt2128408/, A Russell Peters Christmas Special (2011) (TV Special) 
"7.3 based on 3,607 user ratings",Aziz Ansari: Buried Alive,/title/tt2836450/, Aziz Ansari: Buried Alive (2013) (TV Special) 
"7.3 based on 2,128 user ratings","Norm Macdonald: Hitler's Dog, Gossip & Trickery",/title/tt6878486/," Norm Macdonald: Hitler's Dog, Gossip & Trickery (2017) (TV Special) "
6.4 based on 721 user ratings,Hari Kondabolu: Warn Your Relatives,/title/tt8342748/, Hari Kondabolu: Warn Your Relatives (2018) (TV Special) 
"7.5 based on 5,620 user ratings",Ali Wong: Baby Cobra,/title/tt5066574/, Ali Wong: Baby Cobra (2016) (TV Special) 
6.0 based on 209 user ratings,A Little Help with Carol Burnett,/title/tt7204366/, A Little Help with Carol Burnett (2018) (TV Series) 
"6.8 based on 3,196 user ratings",Sarah Silverman A Speck of Dust,/title/tt6948354/, Sarah Silverman: A Speck of Dust (2017) (TV Special) 
"5.3 based on 1,500 user ratings",Historical Roasts,/title/tt9169602/, Historical Roasts (2019) (TV Series) 
"5.2 based on 1,784 user ratings",The Break with Michelle Wolf,/title/tt8010342/, The Break with Michelle Wolf (2018) (TV Series) 
"7.1 based on 2,151 user ratings",Steve Martin and Martin Short: An Evening You Will Forget for the Rest of Your Life,/title/tt8075256/, Steve Martin and Martin Short: An Evening You Will Forget for the Rest of Your Life (2018) (TV Special) 
"6.6 based on 1,090 user ratings",Tig Notaro Happy To Be Here,/title/tt8342946/, Tig Notaro: Happy To Be Here (2018) (TV Special) 
"6.8 based on 1,365 user ratings",Jen Kirkman: I'm Gonna Die Alone (And I Feel Fine),/title/tt4703660/, Jen Kirkman: I'm Gonna Die Alone (And I Feel Fine) (2015) (TV Special) 
"7.1 based on 1,468 user ratings",Wanda Sykes: Not Normal,/title/tt9169592/, Wanda Sykes: Not Normal (2019) (TV Special) 
6.0 based on 875 user ratings,Maria Bamford: Old Baby,/title/tt6264596/, Maria Bamford: Old Baby (2017) (TV Special) 
6.7 based on 911 user ratings,Katt Williams: American Hustle (The Movie),/title/tt1135090/, Katt Williams: American Hustle (2007) (Video) 
"6.1 based on 1,122 user ratings",Tracy Morgan: Staying Alive,/title/tt6680270/, Tracy Morgan: Staying Alive (2017) (TV Special) 
"7.4 based on 3,783 user ratings",Ali Wong: Hard Knock Wife,/title/tt7410684/, Ali Wong: Hard Knock Wife (2018) (TV Special) 
"8.0 based on 5,802 user ratings",John Mulaney: Kid Gorgeous at Radio City,/title/tt8271714/, John Mulaney: Kid Gorgeous at Radio City (2018) (TV Special) 
"2.9 based on 9,234 user ratings",Amy Schumer: The Leather Special,/title/tt6616074/, Amy Schumer: The Leather Special (2017) (TV Special) 
7.2 based on 839 user ratings,Gad Elmaleh: American Dream,/title/tt8110630/, Gad Elmaleh: American Dream (2018) (TV Special) 
"6.6 based on 2,906 user ratings",Aziz Ansari Live at Madison Square Garden,/title/tt4530184/, Aziz Ansari Live in Madison Square Garden (2015) (TV Special) 
6.2 based on 89 user ratings,Bridget Christie: Stand Up for Her,/title/tt7309512/, Bridget Christie: Stand Up for Her (2016) (TV Special) 
"7.2 based on 1,097 user ratings",Jo Koy: Live from Seattle,/title/tt6720442/, Jo Koy: Live from Seattle (2017) (TV Special) 
"8.4 based on 2,306 user ratings",James Acaster: Repertoire,/title/tt7818686/, James Acaster: Repertoire (2018) (TV Mini-Series) 
"7.6 based on 1,070 user ratings",Nate Bargatze: The Tennessee Kid,/title/tt9861504/, Nate Bargatze: The Tennessee Kid (2019) (TV Special) 
Not Found,Dave Chappelle,/name/nm0152638/," Dave Chappelle (Writer, Chappelle's Show (2003))"
"5.2 based on 3,410 user ratings",Amy Schumer Growing,/title/tt9770590/, Amy Schumer: Growing (2019) (TV Special) 
"7.2 based on 3,438 user ratings",Jimmy Carr: Funny Business,/title/tt5222724/, Jimmy Carr: Funny Business (2016) (Video) 
"8.0 based on 3,749 user ratings",Jeff Dunham: Arguing with Myself,/title/tt0806102/, Jeff Dunham: Arguing with Myself (2006) (TV Special) 
"7.5 based on 2,100 user ratings",Jeff Dunham: Controlled Chaos,/title/tt2058636/, Jeff Dunham: Controlled Chaos (2011) (TV Special) 
"7.1 based on 1,275 user ratings",Jeff Dunham: Minding the Monsters,/title/tt2461736/, Jeff Dunham: Minding the Monsters (2012) (TV Special) 
"7.5 based on 2,788 user ratings",Jeff Dunham's Very Special Christmas Special,/title/tt1295909/, Jeff Dunham's Very Special Christmas Special (2008) (TV Special) 
"6.9 based on 1,224 user ratings",Jim Norton: Mouthful of Shame,/title/tt6664120/, Jim Norton: Mouthful of Shame (2017) (TV Special) 
"7.9 based on 14,283 user ratings",Ricky Gervais: Humanity,/title/tt7830574/, Ricky Gervais: Humanity (2018) (TV Special) 
5.3 based on 122 user ratings,Adel Karam: Live from Beirut,/title/tt8081748/, Adel Karam: Live from Beirut (2018) (TV Special) 
5.5 based on 359 user ratings,Miranda Sings Live…Your Welcome,/title/tt9557190/, Miranda Sings Live... Your Welcome (2019) 
"8.3 based on 6,124 user ratings",Bill Burr: You People Are All the Same,/title/tt2290153/, Bill Burr: You People Are All the Same. (2012) (TV Special) 
"8.4 based on 8,284 user ratings",Bo Burnham: Make Happy,/title/tt5192124/, Bo Burnham: Make Happy (2016) (TV Special) 
5.6 based on 125 user ratings,Ralphie May: Imperfectly Yours,/title/tt3216296/, Ralphie May: Imperfectly Yours (2013) (TV Special) 
"6.6 based on 1,563 user ratings",Chris D'Elia: Man on Fire,/title/tt7068896/, Chris D'Elia: Man on Fire (2017) (TV Special) 
6.4 based on 702 user ratings,W. Kamau Bell: Private School Negro,/title/tt8467788/, W. Kamau Bell: Private School Negro (2018) (TV Special) 
4.8 based on 234 user ratings,Mike Epps: Only One Mike,/title/tt10376958/, Mike Epps: Only One Mike (2019) (TV Special) 
6.7 based on 723 user ratings,Rory Scovel Tries Stand-Up for the First Time,/title/tt7044010/, Rory Scovel Tries Stand-Up for the First Time (2017) (TV Special) 
5.7 based on 820 user ratings,Adam Devine: Best Time of Our Lives,/title/tt10376844/, Adam Devine: Best Time of Our Lives (2019) (TV Special) 
"7.8 based on 2,507 user ratings","Oh, Hello On Broadway",/title/tt6987652/," Oh, Hello on Broadway (2017) (TV Movie) "
7.3 based on 707 user ratings,Jo Koy: Comin' In Hot,/title/tt10377036/, Jo Koy: Comin' in Hot (2019) (TV Special) 
"7.5 based on 4,228 user ratings",Aziz Ansari: RIGHT NOW,/title/tt10575038/, Aziz Ansari: Right Now (2019) (TV Special) 
6.6 based on 77 user ratings,Sommore: Chandelier Status,/title/tt3012832/, Sommore: Chandelier Status (2013) (TV Special) 
6.6 based on 184 user ratings,Felipe Esparza: They're Not Going to Laugh at You,/title/tt2153394/, Felipe Esparza: They're Not Gonna Laugh At You (2012) (TV Special) 
6.5 based on 364 user ratings,Joan Rivers: Don't Start with Me,/title/tt2519318/, Joan Rivers: Don't Start with Me (2012) (TV Special) 
5.5 based on 566 user ratings,Katt Williams: Kattpacalypse,/title/tt2370686/, Katt Williams: Kattpacalypse (2012) (TV Special) 
6.1 based on 421 user ratings,Joe Mande’s Award-Winning Comedy Special,/title/tt7183876/, Joe Mande's Award-Winning Comedy Special (2017) (TV Special) 
"7.2 based on 3,232 user ratings",Iliza Shlesinger: Elder Millennial,/title/tt8697266/," Iliza: Elder Millennial (2018) (TV Special) aka ""Iliza Shlesinger: Elder Millennial"" "
6.5 based on 524 user ratings,D.L. Hughley: Contrarian,/title/tt8426270/, D.L. Hughley: Contrarian (2018) (TV Special) 
"7.2 based on 1,401 user ratings",Demetri Martin: The Overthinker,/title/tt7725144/, Demetri Martin: The Overthinker (2018) (TV Special) 
7.0 based on 422 user ratings,Katt Williams: Live,/title/tt0810410/, Katt Williams Live (2006) (Video) 
6.8 based on 635 user ratings,Ari Shaffir: Double Negative,/title/tt6254796/, Ari Shaffir: Double Negative (2016) (TV Special) 
Not Found,Tig,/name/nm0449299/," Tig Notaro (Actress, One Mississippi (2015))"
"7.4 based on 3,418 user ratings",Jim Jefferies: This Is Me Now,/title/tt8617844/, Jim Jefferies: This Is Me Now (2018) (TV Special) 
"6.8 based on 8,415 user ratings",Kevin Hart: Let Me Explain,/title/tt2609912/, Kevin Hart: Let Me Explain (2013) 
6.8 based on 211 user ratings,D.L. Hughley: Clear,/title/tt3589494/, D.L. Hughley: Clear (2014) (TV Special) 
"7.8 based on 2,077 user ratings",Tom Segura: Completely Normal,/title/tt3500822/, Tom Segura: Completely Normal (2014) (TV Special) 
"6.3 based on 1,739 user ratings",Chris Tucker Live,/title/tt4835636/, Chris Tucker Live (2015) (TV Special) 
"6.6 based on 1,361 user ratings",Katherine Ryan: Glitter Room,/title/tt10438648/, Katherine Ryan: Glitter Room (2019) (TV Special) 
"8.5 based on 6,919 user ratings",Bo Burnham: what.,/title/tt3210258/, Bo Burnham: what. (2013) (TV Special) 
"7.8 based on 4,763 user ratings",Jim Jefferies: Freedumb,/title/tt5849950/, Jim Jefferies: Freedumb (2016) (TV Special) 
"7.6 based on 2,813 user ratings",Tom Segura: Mostly Stories,/title/tt4970632/, Tom Segura: Mostly Stories (2016) (TV Special) 
"7.3 based on 5,942 user ratings",Bill Burr: Walk Your Way Out,/title/tt6184894/, Bill Burr: Walk Your Way Out (2017) (TV Special) 
"7.9 based on 5,237 user ratings",Jerry Seinfeld: I'm Telling You for the Last Time,/title/tt0500140/, Jerry Seinfeld: 'I'm Telling You for the Last Time' (1998) (TV Special) 
"6.7 based on 1,154 user ratings",Jen Kirkman: Just Keep Livin’?,/title/tt6386352/, Jen Kirkman: Just Keep Livin? (2017) (TV Special) 
6.3 based on 758 user ratings,Cristela Alonzo: Lower Classy,/title/tt6550456/, Cristela Alonzo: Lower Classy (2017) (TV Special) 
5.0 based on 333 user ratings,Todd Glass: Act Happy,/title/tt7752142/, Todd Glass: Act Happy (2018) (TV Special) 
4.6 based on 143 user ratings,Harith Iskander: I Told You So,/title/tt7902184/, Harith Iskander: I Told You So (2018) (TV Special) 
"7.9 based on 2,696 user ratings",Neal Brennan: 3 Mics,/title/tt6438918/, Neal Brennan: 3 Mics (2017) (TV Special) 
6.1 based on 822 user ratings,Katt Williams: Great America,/title/tt7752054/, Katt Williams: Great America (2018) (TV Special) 
"7.1 based on 1,023 user ratings",Sebastian Maniscalco: Stay Hungry,/title/tt9482786/, Sebastian Maniscalco: Stay Hungry (2019) (TV Special) 
5.2 based on 655 user ratings,Leslie Jones: Time Machine,/title/tt10795784/, Leslie Jones: Time Machine (2020) (TV Special) 
"7.6 based on 2,912 user ratings",Tom Segura: Disgraceful,/title/tt7379330/, Tom Segura: Disgraceful (2018) (TV Special) 
"7.1 based on 2,048 user ratings",Jim Gaffigan: Cinco,/title/tt6090102/, Jim Gaffigan: Cinco (2017) (TV Special) 
6.6 based on 580 user ratings,Jeff Dunham: Unhinged in Hollywood,/title/tt5038776/, Jeff Dunham: Unhinged in Hollywood (2015) (TV Special) 
"6.9 based on 5,319 user ratings",The Original Kings of Comedy,/title/tt0236388/, The Original Kings of Comedy (2000) 
6.8 based on 294 user ratings,Moshe Kasher: Live in Oakland,/title/tt2229301/, Moshe Kasher: Live in Oakland (2012) 
6.3 based on 788 user ratings,Whitney Cummings: Money Shot,/title/tt1659261/, Whitney Cummings: Money Shot (2010) (TV Special) 
"7.2 based on 1,415 user ratings","Ray Romano: Right Here, Around the Corner",/title/tt8101766/," Ray Romano: Right Here, Around the Corner (2019) (TV Special) "
"6.6 based on 1,303 user ratings",Hannibal Buress: Comedy Camisado,/title/tt5352432/, Hannibal Buress: Comedy Camisado (2016) (TV Special) 
8.1 based on 824 user ratings,Dinner for Five,/title/tt0291604/, Dinner for Five (2001) (TV Series) 
"7.5 based on 2,126 user ratings",Mike Birbiglia: Thank God for Jokes,/title/tt6608034/, Mike Birbiglia: Thank God for Jokes (2017) (TV Special) 
"6.5 based on 1,233 user ratings",Marlon Wayans: Woke-ish,/title/tt7655590/, Marlon Wayans: Woke-ish (2018) (TV Special) 
4.7 based on 357 user ratings,Ralphie May: Unruly,/title/tt4454406/, Ralphie May: Unruly (2015) (Video) 
"7.3 based on 3,549 user ratings",Zach Galifianakis: Live at the Purple Onion,/title/tt0804558/, Zach Galifianakis: Live at the Purple Onion (2006) (Video) 
"7.7 based on 1,070 user ratings",Bert Kreischer: The Machine,/title/tt6545220/, Bert Kreischer: The Machine (2016) (TV Special) 
"7.2 based on 4,378 user ratings",Trevor Noah: Afraid of the Dark,/title/tt6562866/, Trevor Noah: Afraid of the Dark (2017) (TV Special) 
7.5 based on 990 user ratings,Kevin James: Sweat the Small Stuff,/title/tt0305727/, Kevin James: Sweat the Small Stuff (2001) (TV Special) 
"5.7 based on 2,010 user ratings","Ken Jeong: You Complete Me, Ho",/title/tt8466562/," Ken Jeong: First Date (2019) (TV Special) aka ""Ken Jeong: You Complete Me, Ho"" "
"6.6 based on 5,803 user ratings",Chris Rock: Tamborine,/title/tt8005338/, Chris Rock: Tamborine (2018) (TV Special) 
"6.9 based on 1,808 user ratings",Katherine Ryan: In Trouble,/title/tt6540084/, Katherine Ryan: In Trouble (2017) (TV Special) 
6.1 based on 453 user ratings,Reggie Watts: Spatial,/title/tt5861260/, Reggie Watts: Spatial (2016) (TV Special) 
6.6 based on 879 user ratings,Craig Ferguson: Tickle Fight,/title/tt7193448/, Craig Ferguson: Tickle Fight (2017) (TV Special) 
"8.4 based on 6,679 user ratings",Bill Burr: I'm Sorry You Feel That Way,/title/tt3823690/, Bill Burr: I'm Sorry You Feel That Way (2014) (TV Special) 
Not Found,Bill Hicks: One Night Stand,Not Found,Not Found
"8.7 based on 2,330 user ratings",Bill Hicks: Relentless,/title/tt0148668/, Bill Hicks: Relentless (1992) (Video) 
"8.6 based on 2,869 user ratings",Bill Hicks: Revelations,/title/tt0152183/, Bill Hicks: Revelations (1993) (TV Special) 
"8.4 based on 2,156 user ratings",Bill Hicks: Sane Man,/title/tt0287337/, Bill Hicks: Sane Man (1989) (Video) 
6.2 based on 61 user ratings,Gina Yashere: Skinny B*tch,/title/tt1722436/, Gina Yashere: Skinny B*tch (2008) (TV Special) 
7.3 based on 572 user ratings,Sam Kinison: Breaking the Rules,/title/tt0307403/, Sam Kinison: Breaking the Rules (1987) (TV Special) 
6.7 based on 231 user ratings,Sam Kinison: Family Entertainment Hour,/title/tt0249934/, The Sam Kinison Family Entertainment Hour (1991) (TV Special) 
6.0 based on 287 user ratings,Tim Allen: Men Are Pigs,/title/tt0259057/, Tim Allen: Men Are Pigs (1990) (TV Special) 
5.8 based on 153 user ratings,Tim Allen: ReWires America,/title/tt0294967/, Tim Allen Rewires America (1991) (TV Special) 
8.5 based on 298 user ratings,Tim Minchin And The Heritage Orchestra Live,/title/tt3709746/, Tim Minchin and the Heritage Orchestra (2011) (Video) 
8.1 based on 205 user ratings,Tim Minchin: So F**king Rock,/title/tt5286440/, Tim Minchin So F**king Rock (2008) (Video) 
6.2 based on 136 user ratings,Todd Glass: Stand-Up Special,/title/tt2803424/," Todd Glass: Talks About Stuff (2012) aka ""Todd Glass: Stand-Up Special"" "
7.2 based on 403 user ratings,Tom Papa Live in New York City,/title/tt1910649/, Tom Papa: Live in New York City (2011) (TV Special) 
Not Found,Dave Chappelle: Equanimity & The Bird Revelation,Not Found,Not Found
6.1 based on 705 user ratings,Tiffany Haddish: Black Mitzvah,/title/tt8882390/, Tiffany Haddish: Black Mitzvah (2019) (TV Special) 
6.8 based on 727 user ratings,Todd Barry: Spicy Honey,/title/tt6856186/, Todd Barry: Spicy Honey (2017) (TV Special) 
5.8 based on 322 user ratings,Stand Up and Away! with Brian Regan,/title/tt9384194/, Standup and Away! with Brian Regan (2018) (TV Series) 
7.4 based on 766 user ratings,Garfunkel and Oates: Trying to be Special,/title/tt5602318/, Garfunkel and Oates: Trying to Be Special (2016) (TV Special) 
"7.5 based on 2,151 user ratings",Gabriel lglesias: I’m Sorry For What I Said When I Was Hungry,/title/tt6302122/, Gabriel Iglesias: I'm Sorry for What I Said When I Was Hungry (2016) (TV Special) 
"7.4 based on 1,258 user ratings",Russell Howard: Recalibrate,/title/tt7736664/, Russell Howard: Recalibrate (2017) (TV Special) 
"6.5 based on 4,276 user ratings",Ellen DeGeneres: Relatable,/title/tt7157574/, Ellen DeGeneres: Relatable (2018) (TV Special) 
4.4 based on 224 user ratings,Mike Epps: Don't Take It Personal,/title/tt5339586/, Mike Epps: Don't Take It Personal (2015) 
"7.4 based on 2,144 user ratings",Ronny Chieng: Asian Comedian Destroys America!,/title/tt11248800/, Ronny Chieng: Asian Comedian Destroys America (2019) (TV Special) 
5.9 based on 621 user ratings,Jack Whitehall: Christmas with My Father,/title/tt11313076/, Jack Whitehall: Christmas with My Father (2019) (TV Special) 
"6.2 based on 1,188 user ratings",Judd Apatow: The Return,/title/tt7738550/, Judd Apatow: The Return (2017) (TV Special) 
"7.2 based on 1,186 user ratings",Michelle Wolf: Joke Show,/title/tt11269704/, Michelle Wolf: Joke Show (2019) (TV Special) 
"5.5 based on 1,624 user ratings",Martin Lawrence Live: Runteldat,/title/tt0327036/, Martin Lawrence Live: Runteldat (2002) 
"8.2 based on 4,430 user ratings",Richard Pryor: Live in Concert,/title/tt0079807/, Richard Pryor: Live in Concert (1979) 
"7.4 based on 2,439 user ratings",Denis Leary: No Cure For Cancer,/title/tt0248752/, Denis Leary: No Cure for Cancer (1993) (TV Special) 
5.7 based on 690 user ratings,Theo Von: No Offense,/title/tt5066564/, Theo Von: No Offense (2016) (TV Special) 
6.5 based on 603 user ratings,I'm Brent Morin,/title/tt5280664/, Brent Morin: I'm Brent Morin (2015) (TV Special) 
Not Found,Jim Jefferies : BARE,/name/nm1812944/," Jim Jefferies (Writer, Legit (2013))"
7.4 based on 842 user ratings,Sebastian Maniscalco: Why Would You Do That,/title/tt6295304/, Sebastian Maniscalco: Why Would You Do That? (2016) (TV Special) 
"6.5 based on 1,502 user ratings",David Cross: Making America Great Again!,/title/tt5943936/, David Cross: Making America Great Again (2016) (TV Special) 
